{
  "schemaVersion": 1,
  "generator": "scripts/pair-junction-contract.js",
  "deterministic": true,
  "generatedAt": "1970-01-01T00:00:00.000Z",
  "sourceManifestVersion": 9,
  "sourceDigest": "3c55cd9aae7d253bacd420fa3fa100771c312d3c4060bcdd2122355d0b50bc72",
  "summary": {
    "passed": true,
    "errorCount": 0,
    "warningCount": 0,
    "checkCount": 6
  },
  "checks": [
    {
      "name": "ids",
      "passed": true
    },
    {
      "name": "coverage",
      "passed": true
    },
    {
      "name": "references",
      "passed": true
    },
    {
      "name": "order",
      "passed": true
    },
    {
      "name": "authored",
      "passed": true
    },
    {
      "name": "flip",
      "passed": true
    }
  ],
  "errors": [],
  "warnings": [],
  "counts": {
    "heroRecipes": 3,
    "requiredPairs": 6,
    "publishedPairs": 6,
    "mouthPairs": 3,
    "hornPairs": 3
  }
}
