{
  "schemaVersion": 1,
  "generator": "scripts/contact-sheet-qa.js",
  "deterministic": true,
  "generatedAt": "1970-01-01T00:00:00.000Z",
  "sourceManifestVersion": 9,
  "sourceDigest": "9c86f03cea1650fe569525265a49cc3d69766a1c9df7b5cefab7c8c6ec9ab292",
  "summary": {
    "passed": true,
    "errorCount": 0,
    "warningCount": 0,
    "checkCount": 7
  },
  "checks": [
    {
      "name": "stable",
      "passed": true
    },
    {
      "name": "metadata",
      "passed": true
    },
    {
      "name": "compatibility",
      "passed": true
    },
    {
      "name": "junctions",
      "passed": true
    },
    {
      "name": "recipes",
      "passed": true
    },
    {
      "name": "order",
      "passed": true
    },
    {
      "name": "authored",
      "passed": true
    }
  ],
  "errors": [],
  "warnings": [],
  "counts": {
    "bases": 6,
    "mouths": 9,
    "horns": 9,
    "finishes": 5,
    "recipes": 16,
    "visualAssets": 80
  }
}
